[
  {
    "contract_version": "0.2.0",
    "record_id": "install-3",
    "tenant_id": "tenant-a",
    "app_id": "app-a",
    "producer": "sdk-android",
    "producer_version": "fixture-v0.1",
    "event_id": "event:install-3",
    "delivery_id": "delivery:install-3",
    "event_name": "install",
    "schema_version": "0.2.0",
    "payload_sha256": "70ef7af8b86614ffdfb4c9a77357e3e9ec4658509220b2fec4395afa19aa7b24",
    "occurred_at": "2026-08-12T00:00:00.000Z",
    "occurred_at_source": "device",
    "received_at": "2026-08-12T00:00:00.000Z",
    "payload_lifecycle_status": "available",
    "raw_payload_ref": "protected:install-3",
    "processing_purpose_id": "analytics",
    "consent_evaluation_policy_version": "consent-v0.1",
    "consent_decision_reason_code": "consent_not_required"
  }
]
