[
  {
    "contract_version": "0.2.0",
    "record_id": "click-12",
    "tenant_id": "tenant-a",
    "app_id": "app-a",
    "producer": "redirector",
    "producer_version": "fixture-v0.1",
    "event_id": "event:click-12",
    "delivery_id": "delivery:click-12",
    "event_name": "click",
    "schema_version": "0.2.0",
    "payload_sha256": "90ad47f54ac200df9d4ee9b662fc6ac687187135b66b48e442939962f75c0849",
    "occurred_at": "2026-08-01T00:00:00.000Z",
    "occurred_at_source": "server",
    "received_at": "2026-08-12T00:00:00.000Z",
    "payload_lifecycle_status": "available",
    "raw_payload_ref": "protected:click-12",
    "processing_purpose_id": "analytics",
    "consent_evaluation_policy_version": "consent-v0.1",
    "consent_decision_reason_code": "consent_not_required"
  },
  {
    "contract_version": "0.2.0",
    "record_id": "install-device-cross",
    "tenant_id": "tenant-a",
    "app_id": "app-a",
    "producer": "sdk-android",
    "producer_version": "fixture-v0.1",
    "event_id": "event:install-device-cross",
    "delivery_id": "delivery:install-device-cross",
    "event_name": "install",
    "schema_version": "0.2.0",
    "payload_sha256": "116f533c2f59fe74f9a99485a9d1a33b9044cd382399682f1d10cf0c273158da",
    "occurred_at": "2026-08-08T00:00:00.001Z",
    "occurred_at_source": "device",
    "received_at": "2026-08-12T00:00:00.000Z",
    "payload_lifecycle_status": "available",
    "raw_payload_ref": "protected:install-device-cross",
    "processing_purpose_id": "analytics",
    "consent_evaluation_policy_version": "consent-v0.1",
    "consent_decision_reason_code": "consent_not_required"
  },
  {
    "contract_version": "0.2.0",
    "record_id": "install-invalid-authority",
    "tenant_id": "tenant-a",
    "app_id": "app-a",
    "producer": "sdk-android",
    "producer_version": "fixture-v0.1",
    "event_id": "event:install-invalid-authority",
    "delivery_id": "delivery:install-invalid-authority",
    "event_name": "install",
    "schema_version": "0.2.0",
    "payload_sha256": "0ef9ff6f9e61471b400eff90258f64e23f68d49212b94e1a0793a4cde17f65f7",
    "occurred_at": "2026-08-07T00:00:00.000Z",
    "occurred_at_source": "device",
    "received_at": "2026-08-12T00:00:00.000Z",
    "payload_lifecycle_status": "available",
    "raw_payload_ref": "protected:install-invalid-authority",
    "processing_purpose_id": "analytics",
    "consent_evaluation_policy_version": "consent-v0.1",
    "consent_decision_reason_code": "consent_not_required"
  },
  {
    "contract_version": "0.2.0",
    "record_id": "install-missing-authority",
    "tenant_id": "tenant-a",
    "app_id": "app-a",
    "producer": "sdk-android",
    "producer_version": "fixture-v0.1",
    "event_id": "event:install-missing-authority",
    "delivery_id": "delivery:install-missing-authority",
    "event_name": "install",
    "schema_version": "0.2.0",
    "payload_sha256": "2d974c32ec6f80e97a93bb35091105481fb2ff3a575f34a6eed9a652a743252f",
    "occurred_at": "2026-08-07T00:00:00.000Z",
    "occurred_at_source": "device",
    "received_at": "2026-08-12T00:00:00.000Z",
    "payload_lifecycle_status": "available",
    "raw_payload_ref": "protected:install-missing-authority",
    "processing_purpose_id": "analytics",
    "consent_evaluation_policy_version": "consent-v0.1",
    "consent_decision_reason_code": "consent_not_required"
  }
]
