[
  {
    "contract_version": "0.2.0",
    "record_id": "click-10-paid",
    "tenant_id": "tenant-a",
    "app_id": "app-a",
    "producer": "redirector",
    "producer_version": "fixture-v0.1",
    "event_id": "event:click-10-paid",
    "delivery_id": "delivery:click-10-paid",
    "event_name": "click",
    "schema_version": "0.2.0",
    "payload_sha256": "91d3f5b3764514e0862b69c975c3e5bada44d91053f319d21a0141e0e333c236",
    "occurred_at": "2026-08-11T12:00:00.000Z",
    "occurred_at_source": "server",
    "received_at": "2026-08-12T00:00:00.000Z",
    "payload_lifecycle_status": "available",
    "raw_payload_ref": "protected:click-10-paid",
    "processing_purpose_id": "analytics",
    "consent_evaluation_policy_version": "consent-v0.1",
    "consent_decision_reason_code": "consent_not_required"
  },
  {
    "contract_version": "0.2.0",
    "record_id": "install-10a",
    "tenant_id": "tenant-a",
    "app_id": "app-a",
    "producer": "sdk-android",
    "producer_version": "fixture-v0.1",
    "event_id": "event:install-10a",
    "delivery_id": "delivery:install-10a",
    "event_name": "install",
    "schema_version": "0.2.0",
    "payload_sha256": "17789bb0bcbd454f79699dc94ba4b5e7b9af561241e2d39213edb909abfe3e16",
    "occurred_at": "2026-08-10T00:00:00.000Z",
    "occurred_at_source": "device",
    "received_at": "2026-08-12T00:00:00.000Z",
    "payload_lifecycle_status": "available",
    "raw_payload_ref": "protected:install-10a",
    "processing_purpose_id": "analytics",
    "consent_evaluation_policy_version": "consent-v0.1",
    "consent_decision_reason_code": "consent_not_required"
  },
  {
    "contract_version": "0.2.0",
    "record_id": "install-10b",
    "tenant_id": "tenant-a",
    "app_id": "app-a",
    "producer": "sdk-android",
    "producer_version": "fixture-v0.1",
    "event_id": "event:install-10b",
    "delivery_id": "delivery:install-10b",
    "event_name": "install",
    "schema_version": "0.2.0",
    "payload_sha256": "0d631745b0d9690e23e168da3c6eac2937a2890b612c71176c44072f2874b5a7",
    "occurred_at": "2026-08-12T00:00:00.000Z",
    "occurred_at_source": "device",
    "received_at": "2026-08-12T00:00:00.000Z",
    "payload_lifecycle_status": "available",
    "raw_payload_ref": "protected:install-10b",
    "processing_purpose_id": "analytics",
    "consent_evaluation_policy_version": "consent-v0.1",
    "consent_decision_reason_code": "consent_not_required"
  },
  {
    "contract_version": "0.2.0",
    "record_id": "install-10c",
    "tenant_id": "tenant-a",
    "app_id": "app-a",
    "producer": "sdk-android",
    "producer_version": "fixture-v0.1",
    "event_id": "event:install-10c",
    "delivery_id": "delivery:install-10c",
    "event_name": "install",
    "schema_version": "0.2.0",
    "payload_sha256": "0026e322ffa294fee1981fdfaf35d1499e4ca55fa49b6b895044475aa27f7ce0",
    "occurred_at": "2026-08-12T01:00:00.000Z",
    "occurred_at_source": "device",
    "received_at": "2026-08-12T01:00:00.000Z",
    "payload_lifecycle_status": "available",
    "raw_payload_ref": "protected:install-10c",
    "processing_purpose_id": "analytics",
    "consent_evaluation_policy_version": "consent-v0.1",
    "consent_decision_reason_code": "consent_not_required"
  }
]
