[
  {
    "contract_version": "0.2.0",
    "record_id": "install-8",
    "tenant_id": "tenant-a",
    "app_id": "app-a",
    "producer": "sdk-android",
    "producer_version": "fixture-v0.1",
    "event_id": "event:install-8",
    "delivery_id": "delivery:install-8",
    "event_name": "install",
    "schema_version": "0.2.0",
    "payload_sha256": "6b1abc0708bfcb9e759afbf7c7e2bddc1e137d2fed1379787c220d9e3763dfef",
    "occurred_at": "2026-08-12T00:00:00.000Z",
    "occurred_at_source": "device",
    "received_at": "2026-08-12T00:01:00.000Z",
    "payload_lifecycle_status": "available",
    "raw_payload_ref": "protected:install-8",
    "processing_purpose_id": "analytics",
    "consent_evaluation_policy_version": "consent-v0.1",
    "consent_decision_reason_code": "consent_not_required"
  },
  {
    "contract_version": "0.2.0",
    "record_id": "revenue-late",
    "tenant_id": "tenant-a",
    "app_id": "app-a",
    "producer": "sdk-android",
    "producer_version": "fixture-v0.1",
    "event_id": "event:revenue-late",
    "delivery_id": "delivery:revenue-late",
    "event_name": "ad_revenue",
    "schema_version": "0.2.0",
    "payload_sha256": "96b216471dda597b4bf921604b13614478f0aa8371191822ae82ab20c7489a72",
    "occurred_at": "2026-08-12T12:00:00.000Z",
    "occurred_at_source": "device",
    "received_at": "2026-08-13T00:00:00.000Z",
    "payload_lifecycle_status": "available",
    "raw_payload_ref": "protected:revenue-late",
    "processing_purpose_id": "analytics",
    "consent_evaluation_policy_version": "consent-v0.1",
    "consent_decision_reason_code": "consent_not_required"
  }
]
