[
  {
    "contract_version": "0.2.0",
    "record_id": "install-unavailable",
    "tenant_id": "tenant-a",
    "app_id": "app-a",
    "producer": "sdk-android",
    "producer_version": "fixture-v0.1",
    "event_id": "event:install-unavailable",
    "delivery_id": "delivery:install-unavailable",
    "event_name": "install",
    "schema_version": "0.2.0",
    "payload_sha256": "b754da8a591855b99f92c717ff0ae5c1adb9b9851729d5b3066415c5ef41da4b",
    "occurred_at": "2026-08-12T00:00:00.000Z",
    "occurred_at_source": "device",
    "received_at": "2026-08-12T00:00:00.000Z",
    "payload_lifecycle_status": "available",
    "raw_payload_ref": "protected:install-unavailable",
    "processing_purpose_id": "analytics",
    "consent_evaluation_policy_version": "consent-v0.1",
    "consent_decision_reason_code": "consent_not_required"
  },
  {
    "contract_version": "0.2.0",
    "record_id": "install-unsupported",
    "tenant_id": "tenant-a",
    "app_id": "app-a",
    "producer": "sdk-android",
    "producer_version": "fixture-v0.1",
    "event_id": "event:install-unsupported",
    "delivery_id": "delivery:install-unsupported",
    "event_name": "install",
    "schema_version": "0.2.0",
    "payload_sha256": "db760e891f796c90695eda78bd30ef5e985a45fd5b3954f4dacbb7f88a8c7bab",
    "occurred_at": "2026-08-12T00:00:00.000Z",
    "occurred_at_source": "device",
    "received_at": "2026-08-12T00:00:00.000Z",
    "payload_lifecycle_status": "available",
    "raw_payload_ref": "protected:install-unsupported",
    "processing_purpose_id": "analytics",
    "consent_evaluation_policy_version": "consent-v0.1",
    "consent_decision_reason_code": "consent_not_required"
  }
]
