[
  {
    "contract_version": "0.2.0",
    "record_id": "click-4",
    "tenant_id": "tenant-a",
    "app_id": "app-a",
    "producer": "redirector",
    "producer_version": "fixture-v0.1",
    "event_id": "event:click-4",
    "delivery_id": "delivery:click-4",
    "event_name": "click",
    "schema_version": "0.2.0",
    "payload_sha256": "c0cc4a1ad381d453fdb70616366fd93c117735cd44603b5a1540f244df7b4c9e",
    "occurred_at": "2026-08-01T00:00:00.000Z",
    "occurred_at_source": "server",
    "received_at": "2026-08-12T00:00:00.000Z",
    "payload_lifecycle_status": "available",
    "raw_payload_ref": "protected:click-4",
    "processing_purpose_id": "analytics",
    "consent_evaluation_policy_version": "consent-v0.1",
    "consent_decision_reason_code": "consent_not_required"
  },
  {
    "contract_version": "0.2.0",
    "record_id": "install-after",
    "tenant_id": "tenant-a",
    "app_id": "app-a",
    "producer": "sdk-android",
    "producer_version": "fixture-v0.1",
    "event_id": "event:install-after",
    "delivery_id": "delivery:install-after",
    "event_name": "install",
    "schema_version": "0.2.0",
    "payload_sha256": "0ad9bec0db00b50d84fa0870a5d48905be89cb83101586a7b559d5e61340e599",
    "occurred_at": "2026-08-08T00:00:00.001Z",
    "occurred_at_source": "device",
    "received_at": "2026-08-12T00:00:00.000Z",
    "payload_lifecycle_status": "available",
    "raw_payload_ref": "protected:install-after",
    "processing_purpose_id": "analytics",
    "consent_evaluation_policy_version": "consent-v0.1",
    "consent_decision_reason_code": "consent_not_required"
  },
  {
    "contract_version": "0.2.0",
    "record_id": "install-before",
    "tenant_id": "tenant-a",
    "app_id": "app-a",
    "producer": "sdk-android",
    "producer_version": "fixture-v0.1",
    "event_id": "event:install-before",
    "delivery_id": "delivery:install-before",
    "event_name": "install",
    "schema_version": "0.2.0",
    "payload_sha256": "c38f8587e46c4ea0372e0e212d60c88385453e4c7834eb3adeb5ad4556bd72d3",
    "occurred_at": "2026-08-07T23:59:59.999Z",
    "occurred_at_source": "device",
    "received_at": "2026-08-12T00:00:00.000Z",
    "payload_lifecycle_status": "available",
    "raw_payload_ref": "protected:install-before",
    "processing_purpose_id": "analytics",
    "consent_evaluation_policy_version": "consent-v0.1",
    "consent_decision_reason_code": "consent_not_required"
  },
  {
    "contract_version": "0.2.0",
    "record_id": "install-exact",
    "tenant_id": "tenant-a",
    "app_id": "app-a",
    "producer": "sdk-android",
    "producer_version": "fixture-v0.1",
    "event_id": "event:install-exact",
    "delivery_id": "delivery:install-exact",
    "event_name": "install",
    "schema_version": "0.2.0",
    "payload_sha256": "675c056024a186e107b2859f42010124e36f39cf03442d37b610396ca2100316",
    "occurred_at": "2026-08-08T00:00:00.000Z",
    "occurred_at_source": "device",
    "received_at": "2026-08-12T00:00:00.000Z",
    "payload_lifecycle_status": "available",
    "raw_payload_ref": "protected:install-exact",
    "processing_purpose_id": "analytics",
    "consent_evaluation_policy_version": "consent-v0.1",
    "consent_decision_reason_code": "consent_not_required"
  }
]
