[
  {
    "contract_version": "0.2.0",
    "record_id": "click-1",
    "tenant_id": "tenant-a",
    "app_id": "app-a",
    "producer": "redirector",
    "producer_version": "fixture-v0.1",
    "event_id": "event:click-1",
    "delivery_id": "delivery:click-1",
    "event_name": "click",
    "schema_version": "0.2.0",
    "payload_sha256": "10d76accfdb1d74a63e389c27bc184268b7742d03e83b6858f2373caec85b9c4",
    "occurred_at": "2026-08-05T00:00:00.000Z",
    "occurred_at_source": "server",
    "received_at": "2026-08-12T00:00:00.000Z",
    "payload_lifecycle_status": "available",
    "raw_payload_ref": "protected:click-1",
    "processing_purpose_id": "analytics",
    "consent_evaluation_policy_version": "consent-v0.1",
    "consent_decision_reason_code": "consent_not_required"
  },
  {
    "contract_version": "0.2.0",
    "record_id": "install-1",
    "tenant_id": "tenant-a",
    "app_id": "app-a",
    "producer": "sdk-android",
    "producer_version": "fixture-v0.1",
    "event_id": "event:install-1",
    "delivery_id": "delivery:install-1",
    "event_name": "install",
    "schema_version": "0.2.0",
    "payload_sha256": "eb279124485c6f17452977b6176d4d35a4d146ef557ac9cf88c3a6e69dc98874",
    "occurred_at": "2026-08-06T00:00:00.000Z",
    "occurred_at_source": "device",
    "received_at": "2026-08-12T00:00:00.000Z",
    "payload_lifecycle_status": "available",
    "raw_payload_ref": "protected:install-1",
    "processing_purpose_id": "analytics",
    "consent_evaluation_policy_version": "consent-v0.1",
    "consent_decision_reason_code": "consent_not_required"
  }
]
