[
  {
    "contract_version": "0.2.0",
    "record_id": "prefetch-click",
    "tenant_id": "tenant-a",
    "app_id": "app-a",
    "producer": "redirector",
    "producer_version": "fixture-v0.1",
    "event_id": "event:prefetch-click",
    "delivery_id": "delivery:prefetch-click",
    "event_name": "click",
    "schema_version": "0.2.0",
    "payload_sha256": "5c86946d238fde8c050a19e6b68cc0db51dbeb2018cd79f4c5552ed9c130ad76",
    "occurred_at": "2026-08-10T00:00:00.000Z",
    "occurred_at_source": "server",
    "received_at": "2026-08-12T00:00:00.000Z",
    "payload_lifecycle_status": "available",
    "raw_payload_ref": "protected:prefetch-click",
    "processing_purpose_id": "analytics",
    "consent_evaluation_policy_version": "consent-v0.1",
    "consent_decision_reason_code": "consent_not_required"
  },
  {
    "contract_version": "0.2.0",
    "record_id": "prefetch-install",
    "tenant_id": "tenant-a",
    "app_id": "app-a",
    "producer": "sdk-android",
    "producer_version": "fixture-v0.1",
    "event_id": "event:prefetch-install",
    "delivery_id": "delivery:prefetch-install",
    "event_name": "install",
    "schema_version": "0.2.0",
    "payload_sha256": "dfc3ac1266c67ed7995c754b231ceb24b4e805aa2ebb16acaaeebf95382bf276",
    "occurred_at": "2026-08-11T00:00:00.000Z",
    "occurred_at_source": "device",
    "received_at": "2026-08-12T00:00:00.000Z",
    "payload_lifecycle_status": "available",
    "raw_payload_ref": "protected:prefetch-install",
    "processing_purpose_id": "analytics",
    "consent_evaluation_policy_version": "consent-v0.1",
    "consent_decision_reason_code": "consent_not_required"
  }
]
