[
  {
    "contract_version": "0.2.0",
    "record_id": "dup-first",
    "tenant_id": "tenant-a",
    "app_id": "app-a",
    "producer": "redirector",
    "producer_version": "fixture-v0.1",
    "event_id": "event:dup-first",
    "delivery_id": "delivery:dup-first",
    "event_name": "click",
    "schema_version": "0.2.0",
    "payload_sha256": "a70ecf1989f45a27786a37d1da96821a97d3bc7538cab0ad11404d34c8f3f2a0",
    "occurred_at": "2026-08-10T00:00:00.000Z",
    "occurred_at_source": "server",
    "received_at": "2026-08-12T00:00:00.000Z",
    "payload_lifecycle_status": "available",
    "raw_payload_ref": "protected:dup-first",
    "processing_purpose_id": "analytics",
    "consent_evaluation_policy_version": "consent-v0.1",
    "consent_decision_reason_code": "consent_not_required"
  }
]
