[
  {
    "contract_version": "0.2.0",
    "record_id": "install-9",
    "tenant_id": "tenant-a",
    "app_id": "app-a",
    "producer": "sdk-android",
    "producer_version": "fixture-v0.1",
    "event_id": "event:install-9",
    "delivery_id": "delivery:install-9",
    "event_name": "install",
    "schema_version": "0.2.0",
    "payload_sha256": "9a3dc4ce0e3497c6a63e05b735b9346f94994af82c64e4890af481e275fd76d8",
    "occurred_at": "2026-08-11T23:59:00.000Z",
    "occurred_at_source": "device",
    "received_at": "2026-08-12T00:00:00.000Z",
    "payload_lifecycle_status": "available",
    "raw_payload_ref": "protected:install-9",
    "processing_purpose_id": "analytics",
    "consent_evaluation_policy_version": "consent-v0.1",
    "consent_decision_reason_code": "consent_not_required"
  },
  {
    "contract_version": "0.2.0",
    "record_id": "revenue-9",
    "tenant_id": "tenant-a",
    "app_id": "app-a",
    "producer": "sdk-android",
    "producer_version": "fixture-v0.1",
    "event_id": "event:revenue-9",
    "delivery_id": "delivery:revenue-9",
    "event_name": "ad_revenue",
    "schema_version": "0.2.0",
    "payload_sha256": "2e726cf145e9147ea3001cc04f20950af4e2a95e3107d91ae8893da44d176184",
    "occurred_at": "2026-08-12T00:01:00.000Z",
    "occurred_at_source": "device",
    "received_at": "2026-08-12T00:00:00.000Z",
    "payload_lifecycle_status": "available",
    "raw_payload_ref": "protected:revenue-9",
    "processing_purpose_id": "analytics",
    "consent_evaluation_policy_version": "consent-v0.1",
    "consent_decision_reason_code": "consent_not_required"
  }
]
