[
  {
    "contract_version": "0.2.0",
    "record_id": "import-install-30",
    "tenant_id": "tenant-a",
    "app_id": "app-a",
    "producer": "import:synthetic-provider",
    "producer_version": "fixture-v0.2",
    "event_id": "event:import-install-30",
    "delivery_id": "delivery:import-install-30",
    "event_name": "install",
    "schema_version": "0.2.0",
    "payload_sha256": "c5313dce295fcc0122fca79fca61a37fcbc401fc63a0caf6e64f8601cb668d84",
    "occurred_at": "2026-08-18T02:00:00.000Z",
    "occurred_at_source": "import",
    "received_at": "2026-08-18T03:00:00.000Z",
    "payload_lifecycle_status": "available",
    "raw_payload_ref": "protected:import-install-30",
    "processing_purpose_id": "analytics",
    "consent_evaluation_policy_version": "consent-v0.2",
    "consent_decision_reason_code": "consent_not_required"
  },
  {
    "contract_version": "0.2.0",
    "record_id": "import-revenue-30",
    "tenant_id": "tenant-a",
    "app_id": "app-a",
    "producer": "import:synthetic-provider",
    "producer_version": "fixture-v0.2",
    "event_id": "event:import-revenue-30",
    "delivery_id": "delivery:import-revenue-30",
    "event_name": "ad_revenue",
    "schema_version": "0.2.0",
    "payload_sha256": "87710a44f0ec18df0421e41d602e2d172310f68c27a9472160730a6dbbaa1eb3",
    "occurred_at": "2026-08-18T02:10:00.000Z",
    "occurred_at_source": "import",
    "received_at": "2026-08-18T03:00:00.000Z",
    "payload_lifecycle_status": "available",
    "raw_payload_ref": "protected:import-revenue-30",
    "processing_purpose_id": "analytics",
    "consent_evaluation_policy_version": "consent-v0.2",
    "consent_decision_reason_code": "consent_not_required"
  },
  {
    "contract_version": "0.2.0",
    "record_id": "postback-revenue-30",
    "tenant_id": "tenant-a",
    "app_id": "app-a",
    "producer": "postback:synthetic-kind",
    "producer_version": "fixture-v0.2",
    "event_id": "event:postback-revenue-30",
    "delivery_id": "delivery:postback-revenue-30",
    "event_name": "ad_revenue",
    "schema_version": "0.2.0",
    "payload_sha256": "2ccf3b324e4576420e442d2b0f7ad72d45bc8f43e531841579fecd8309444b34",
    "occurred_at": "2026-08-18T02:20:00.000Z",
    "occurred_at_source": "server",
    "received_at": "2026-08-18T03:00:00.000Z",
    "payload_lifecycle_status": "available",
    "raw_payload_ref": "protected:postback-revenue-30",
    "processing_purpose_id": "analytics",
    "consent_evaluation_policy_version": "consent-v0.2",
    "consent_decision_reason_code": "consent_not_required"
  }
]
