[
  {
    "contract_version": "0.2.0",
    "record_id": "click-25",
    "tenant_id": "tenant-a",
    "app_id": "app-a",
    "producer": "redirector",
    "producer_version": "fixture-v0.2",
    "event_id": "event:click-25",
    "delivery_id": "delivery:click-25",
    "event_name": "click",
    "schema_version": "0.2.0",
    "payload_sha256": "343a72fe1e6312440e1984b62de3e610fde0bf40ec5784d0139cc60382bdf773",
    "occurred_at": "2026-08-12T00:00:00.000Z",
    "occurred_at_source": "server",
    "received_at": "2026-08-12T00:00:00.000Z",
    "payload_lifecycle_status": "available",
    "raw_payload_ref": "protected:click-25",
    "processing_purpose_id": "fraud-prevention",
    "consent_evaluation_policy_version": "fraud-v0.2",
    "consent_decision_reason_code": "consent_not_required"
  }
]
