[
  {
    "contract_version": "0.2.0",
    "record_id": "impression-27",
    "tenant_id": "tenant-a",
    "app_id": "app-a",
    "producer": "sdk-android",
    "producer_version": "fixture-v0.2",
    "event_id": "event:impression-27",
    "delivery_id": "delivery:impression-27",
    "event_name": "ad_impression",
    "schema_version": "0.2.0",
    "payload_sha256": "8c9903e2033b2c61db7c61c8804ce329f0341ae8a6a6a214fea0e76425ec1f51",
    "occurred_at": "2026-08-12T00:59:59.000Z",
    "occurred_at_source": "device",
    "received_at": "2026-08-12T01:00:00.000Z",
    "payload_lifecycle_status": "available",
    "raw_payload_ref": "protected:impression-27",
    "processing_purpose_id": "analytics",
    "consent_evaluation_policy_version": "consent-v0.2",
    "consent_decision_reason_code": "consent_not_required"
  },
  {
    "contract_version": "0.2.0",
    "record_id": "install-27",
    "tenant_id": "tenant-a",
    "app_id": "app-a",
    "producer": "sdk-android",
    "producer_version": "fixture-v0.2",
    "event_id": "event:install-27",
    "delivery_id": "delivery:install-27",
    "event_name": "install",
    "schema_version": "0.2.0",
    "payload_sha256": "4e5fcee785e680fa0832599d7d0612b260df51caaf52c37113086387297f6b55",
    "occurred_at": "2026-08-12T00:00:00.000Z",
    "occurred_at_source": "device",
    "received_at": "2026-08-12T00:01:00.000Z",
    "payload_lifecycle_status": "available",
    "raw_payload_ref": "protected:install-27",
    "processing_purpose_id": "analytics",
    "consent_evaluation_policy_version": "consent-v0.2",
    "consent_decision_reason_code": "consent_not_required"
  },
  {
    "contract_version": "0.2.0",
    "record_id": "revenue-27",
    "tenant_id": "tenant-a",
    "app_id": "app-a",
    "producer": "sdk-android",
    "producer_version": "fixture-v0.2",
    "event_id": "event:revenue-27",
    "delivery_id": "delivery:revenue-27",
    "event_name": "ad_revenue",
    "schema_version": "0.2.0",
    "payload_sha256": "ee9832a71919bad13a7e23521abac030c8a24997641511e8d7d9c004104d6873",
    "occurred_at": "2026-08-12T01:00:00.000Z",
    "occurred_at_source": "device",
    "received_at": "2026-08-12T01:01:00.000Z",
    "payload_lifecycle_status": "available",
    "raw_payload_ref": "protected:revenue-27",
    "processing_purpose_id": "analytics",
    "consent_evaluation_policy_version": "consent-v0.2",
    "consent_decision_reason_code": "consent_not_required"
  }
]
